id;title;author;authoryearofbirth;authoryearofdeath;language;downloads;subjects;type;alpha_pdf;total_words;unique_words
PG89;North American Free Trade Agreement, 1992 Oct. 7 Tariff Phasing Descriptions;Canada;;;['en'];18;{'Foreign trade regulation -- North America', 'Free trade -- Canada', 'Free trade -- United States', 'Free trade -- Mexico', 'Tariff -- Law and legislation -- North America', 'Canada. Treaties, etc. 1992 Oct. 7', 'Free trade -- North America'};Text;1.1156439014138897;61586;4610
PG90;The Son of Tarzan;Burroughs, Edgar Rice;1875;1950;['en'];297;{'Tarzan (Fictitious character) -- Fiction', 'Fantasy fiction', 'Adventure stories'};Text;1.2067678471011032;94634;7348
PG91;Tom Sawyer Abroad;Twain, Mark;1835;1910;['en'];167;{'Americans -- Foreign countries -- Fiction', 'Balloon ascensions -- Fiction', 'Sawyer, Tom (Fictitious character) -- Fiction', 'Adventure stories'};Text;"""There is no item named 'SPGC-counts-2018-07-18/PG91_counts.txt' in the archive"""
PG92;Tarzan and the Jewels of Opar;Burroughs, Edgar Rice;1875;1950;['en'];220;{'Tarzan (Fictitious character) -- Fiction', 'Fantasy fiction', 'Adventure stories'};Text;1.1525150860811608;65770;6264
PG93;Tom Sawyer, Detective;Twain, Mark;1835;1910;['en'];116;{'Sawyer, Tom (Fictitious character) -- Fiction', 'Mystery fiction'};Text;"""There is no item named 'SPGC-counts-2018-07-18/PG93_counts.txt' in the archive"""
PG94;Alexander's Bridge;Cather, Willa;1873;1947;['en'];78;{'Mistresses -- Fiction', 'Married people -- Fiction', 'London (England) -- Fiction', 'Bridges -- Design and construction -- Fiction', 'Psychological fiction', 'Civil engineers -- Fiction', 'Boston (Mass.) -- Fiction'};Text;"""There is no item named 'SPGC-counts-2018-07-18/PG94_counts.txt' in the archive"""
PG95;The Prisoner of Zenda;Hope, Anthony;1863;1933;['en'];410;{'Impostors and imposture -- Fiction', 'British -- Foreign countries -- Fiction', 'Adventure stories'};Text;"""There is no item named 'SPGC-counts-2018-07-18/PG95_counts.txt' in the archive"""
PG96;The Monster Men;Burroughs, Edgar Rice;1875;1950;['en'];145;{'Fantasy fiction', 'Science fiction'};Text;1.1540842900363806;57728;5609
PG97;Flatland: A Romance of Many Dimensions;Abbott, Edwin Abbott;1838;1926;['en'];438;{'Fourth dimension'};Text;1.0536501678582917;33511;4514
PG98;A Tale of Two Cities;Dickens, Charles;1812;1870;['en'];11283;{'French -- England -- London -- Fiction', 'Lookalikes -- Fiction', 'Paris (France) -- History -- 1789-1799 -- Fiction', 'Executions and executioners -- Fiction', 'London (England) -- History -- 18th century -- Fiction', 'France -- History -- Revolution, 1789-1799 -- Fiction', 'British -- France -- Paris -- Fiction', 'War stories', 'Historical fiction'};Text;"""There is no item named 'SPGC-counts-2018-07-18/PG98_counts.txt' in the archive"""
